{
 "kind": "coinswitch-cost-model",
 "schemaVersion": 1,
 "modelVersion": "example-cost-20261016T1115Z-ff64f5ba",
 "producer": "ts-reference-fit (example only)",
 "trainedAt": "2026-10-16T11:15:12.266Z",
 "datasetRowCounts": {
  "quoteSamples": 8571,
  "quoteDrift": 2255
 },
 "datasetTimeRange": {
  "from": "2026-10-16T04:04:14.758Z",
  "to": "2026-10-16T11:14:55.673Z"
 },
 "split": {
  "method": "time",
  "cutoff": "2026-10-16T09:15:55.181Z",
  "trainRows": {
   "impact": 4211,
   "drift": 1297
  },
  "testRows": {
   "impact": 2001,
   "drift": 431
  }
 },
 "pairs": {
  "BONK/USDC": "thin",
  "JUP/USDC": "thin",
  "SOL/USDC": "deep",
  "SOL/USDT": "deep",
  "USDC/SOL": "deep",
  "USDC/USDT": "deep",
  "USDT/SOL": "deep",
  "USDT/USDC": "deep",
  "WIF/USDC": "thin"
 },
 "constants": {
  "baselineRung": 1,
  "impactFloorBps": 0.5,
  "maxLadderSpanSeconds": 30,
  "measuredHorizons": [
   5,
   15,
   30,
   60
  ],
  "minCellN": 20,
  "minConfidentN": 30,
  "quantilePoints": 101
 },
 "volatility": {
  "windowMinutes": 30,
  "rung": 1,
  "minReturns": 8,
  "maxGapSeconds": 600,
  "unit": "bps per sqrt(minute)"
 },
 "features": [
  {
   "name": "sqrt_horizon_s",
   "derivation": "sqrt(horizonSeconds)",
   "mean": 5.5751179149572705,
   "std": 1.9854596977003192
  },
  {
   "name": "vol_sigma_bps",
   "derivation": "vol_bps_per_sqrt_min * sqrt(horizonSeconds / 60)",
   "mean": 4.05580149585991,
   "std": 2.5858202618717456
  },
  {
   "name": "thin_sqrt_horizon_s",
   "derivation": "(1 if thin else 0) * sqrt(horizonSeconds)",
   "mean": 0.36504198759700557,
   "std": 1.4224598397531376
  }
 ],
 "impact": {
  "model": "powerlaw",
  "baselineNotionalUsd": 25,
  "perPair": {
   "BONK/USDC": {
    "a": 11.534307371333126,
    "b": 0.9392291488603353,
    "n": 160,
    "notionalMinUsd": 100,
    "notionalMaxUsd": 1000000
   },
   "JUP/USDC": {
    "a": 0.7917911115435166,
    "b": 0.9652558279895351,
    "n": 123,
    "notionalMinUsd": 100,
    "notionalMaxUsd": 1000000
   },
   "SOL/USDC": {
    "a": 0.6956584773995723,
    "b": 0.22491678047998542,
    "n": 229,
    "notionalMinUsd": 105.371596,
    "notionalMaxUsd": 1068195.438111
   },
   "SOL/USDT": {
    "a": 0.8187660319187026,
    "b": 0.17917111635586097,
    "n": 234,
    "notionalMinUsd": 105.204992,
    "notionalMaxUsd": 1068195.438111
   },
   "USDC/SOL": {
    "a": 0.8458240757774603,
    "b": 0.1838740133705377,
    "n": 281,
    "notionalMinUsd": 105.07543,
    "notionalMaxUsd": 1068195.438111
   },
   "USDC/USDT": {
    "a": 0.7036738659406245,
    "b": 0.06266512305876375,
    "n": 9,
    "notionalMinUsd": 106.184491,
    "notionalMaxUsd": 42521.322487
   },
   "USDT/SOL": {
    "a": 1.1624524421401143,
    "b": 0.021895456885852718,
    "n": 188,
    "notionalMinUsd": 105.438206,
    "notionalMaxUsd": 42630.379859
   },
   "USDT/USDC": {
    "a": 1.0865515575974642,
    "b": 0.00412887394264187,
    "n": 34,
    "notionalMinUsd": 106.232457,
    "notionalMaxUsd": 42619.992597
   },
   "WIF/USDC": {
    "a": 13.27727883734785,
    "b": 0.7186907580331504,
    "n": 161,
    "notionalMinUsd": 100,
    "notionalMaxUsd": 1000000
   }
  },
  "byDepth": {
   "deep": {
    "a": 0.8591208833333343,
    "b": 0.16441799292962517,
    "n": 975,
    "notionalMinUsd": 105.07543,
    "notionalMaxUsd": 1068195.438111
   },
   "thin": {
    "a": 7.202680352437678,
    "b": 0.7944537423917971,
    "n": 444,
    "notionalMinUsd": 100,
    "notionalMaxUsd": 1000000
   }
  },
  "cells": [
   {
    "pair": "BONK/USDC",
    "rung": 0,
    "notionalUsd": 5,
    "n": 70
   },
   {
    "pair": "BONK/USDC",
    "rung": 1,
    "notionalUsd": 25,
    "n": 70
   },
   {
    "pair": "BONK/USDC",
    "rung": 2,
    "notionalUsd": 100,
    "n": 70
   },
   {
    "pair": "BONK/USDC",
    "rung": 3,
    "notionalUsd": 500,
    "n": 70
   },
   {
    "pair": "BONK/USDC",
    "rung": 4,
    "notionalUsd": 2000,
    "n": 70
   },
   {
    "pair": "BONK/USDC",
    "rung": 5,
    "notionalUsd": 10000,
    "n": 70
   },
   {
    "pair": "BONK/USDC",
    "rung": 6,
    "notionalUsd": 40000,
    "n": 70
   },
   {
    "pair": "BONK/USDC",
    "rung": 7,
    "notionalUsd": 200000,
    "n": 70
   },
   {
    "pair": "BONK/USDC",
    "rung": 8,
    "notionalUsd": 1000000,
    "n": 70
   },
   {
    "pair": "JUP/USDC",
    "rung": 0,
    "notionalUsd": 5,
    "n": 71
   },
   {
    "pair": "JUP/USDC",
    "rung": 1,
    "notionalUsd": 25,
    "n": 71
   },
   {
    "pair": "JUP/USDC",
    "rung": 2,
    "notionalUsd": 100,
    "n": 71
   },
   {
    "pair": "JUP/USDC",
    "rung": 3,
    "notionalUsd": 500,
    "n": 71
   },
   {
    "pair": "JUP/USDC",
    "rung": 4,
    "notionalUsd": 2000,
    "n": 71
   },
   {
    "pair": "JUP/USDC",
    "rung": 5,
    "notionalUsd": 10000,
    "n": 71
   },
   {
    "pair": "JUP/USDC",
    "rung": 6,
    "notionalUsd": 40000,
    "n": 71
   },
   {
    "pair": "JUP/USDC",
    "rung": 7,
    "notionalUsd": 200000,
    "n": 71
   },
   {
    "pair": "JUP/USDC",
    "rung": 8,
    "notionalUsd": 1000000,
    "n": 71
   },
   {
    "pair": "SOL/USDC",
    "rung": 0,
    "notionalUsd": 5.313862,
    "n": 181
   },
   {
    "pair": "SOL/USDC",
    "rung": 1,
    "notionalUsd": 26.568556,
    "n": 182
   },
   {
    "pair": "SOL/USDC",
    "rung": 2,
    "notionalUsd": 106.271216,
    "n": 183
   },
   {
    "pair": "SOL/USDC",
    "rung": 3,
    "notionalUsd": 531.35608,
    "n": 183
   },
   {
    "pair": "SOL/USDC",
    "rung": 4,
    "notionalUsd": 2125.42432,
    "n": 183
   },
   {
    "pair": "SOL/USDC",
    "rung": 5,
    "notionalUsd": 10627.1216,
    "n": 183
   },
   {
    "pair": "SOL/USDC",
    "rung": 6,
    "notionalUsd": 42508.4864,
    "n": 183
   },
   {
    "pair": "SOL/USDC",
    "rung": 7,
    "notionalUsd": 213061.251642,
    "n": 72
   },
   {
    "pair": "SOL/USDC",
    "rung": 8,
    "notionalUsd": 1065306.258212,
    "n": 72
   },
   {
    "pair": "SOL/USDT",
    "rung": 0,
    "notionalUsd": 5.318582,
    "n": 179
   },
   {
    "pair": "SOL/USDT",
    "rung": 1,
    "notionalUsd": 26.592063,
    "n": 180
   },
   {
    "pair": "SOL/USDT",
    "rung": 2,
    "notionalUsd": 106.368252,
    "n": 180
   },
   {
    "pair": "SOL/USDT",
    "rung": 3,
    "notionalUsd": 531.8412599999999,
    "n": 180
   },
   {
    "pair": "SOL/USDT",
    "rung": 4,
    "notionalUsd": 2127.3650399999997,
    "n": 180
   },
   {
    "pair": "SOL/USDT",
    "rung": 5,
    "notionalUsd": 10636.8252,
    "n": 180
   },
   {
    "pair": "SOL/USDT",
    "rung": 6,
    "notionalUsd": 42547.3008,
    "n": 180
   },
   {
    "pair": "SOL/USDT",
    "rung": 7,
    "notionalUsd": 213078.4252395,
    "n": 72
   },
   {
    "pair": "SOL/USDT",
    "rung": 8,
    "notionalUsd": 1065392.1261985,
    "n": 72
   },
   {
    "pair": "USDC/SOL",
    "rung": 0,
    "notionalUsd": 5.3134885,
    "n": 182
   },
   {
    "pair": "USDC/SOL",
    "rung": 1,
    "notionalUsd": 26.567443500000003,
    "n": 182
   },
   {
    "pair": "USDC/SOL",
    "rung": 2,
    "notionalUsd": 106.269164,
    "n": 183
   },
   {
    "pair": "USDC/SOL",
    "rung": 3,
    "notionalUsd": 531.345822,
    "n": 183
   },
   {
    "pair": "USDC/SOL",
    "rung": 4,
    "notionalUsd": 2125.383288,
    "n": 183
   },
   {
    "pair": "USDC/SOL",
    "rung": 5,
    "notionalUsd": 10626.91644,
    "n": 183
   },
   {
    "pair": "USDC/SOL",
    "rung": 6,
    "notionalUsd": 42507.665761,
    "n": 183
   },
   {
    "pair": "USDC/SOL",
    "rung": 7,
    "notionalUsd": 213068.370121,
    "n": 72
   },
   {
    "pair": "USDC/SOL",
    "rung": 8,
    "notionalUsd": 1065341.850609,
    "n": 72
   },
   {
    "pair": "USDC/USDT",
    "rung": 0,
    "notionalUsd": 5.3094885000000005,
    "n": 106
   },
   {
    "pair": "USDC/USDT",
    "rung": 1,
    "notionalUsd": 26.5463,
    "n": 107
   },
   {
    "pair": "USDC/USDT",
    "rung": 2,
    "notionalUsd": 106.1852,
    "n": 107
   },
   {
    "pair": "USDC/USDT",
    "rung": 3,
    "notionalUsd": 530.925998,
    "n": 107
   },
   {
    "pair": "USDC/USDT",
    "rung": 4,
    "notionalUsd": 2123.703993,
    "n": 107
   },
   {
    "pair": "USDC/USDT",
    "rung": 5,
    "notionalUsd": 10618.519963,
    "n": 107
   },
   {
    "pair": "USDC/USDT",
    "rung": 6,
    "notionalUsd": 42474.07985,
    "n": 107
   },
   {
    "pair": "USDT/SOL",
    "rung": 0,
    "notionalUsd": 5.315948,
    "n": 107
   },
   {
    "pair": "USDT/SOL",
    "rung": 1,
    "notionalUsd": 26.579739,
    "n": 107
   },
   {
    "pair": "USDT/SOL",
    "rung": 2,
    "notionalUsd": 106.318954,
    "n": 107
   },
   {
    "pair": "USDT/SOL",
    "rung": 3,
    "notionalUsd": 531.594772,
    "n": 107
   },
   {
    "pair": "USDT/SOL",
    "rung": 4,
    "notionalUsd": 2126.379088,
    "n": 107
   },
   {
    "pair": "USDT/SOL",
    "rung": 5,
    "notionalUsd": 10631.951563999999,
    "n": 106
   },
   {
    "pair": "USDT/SOL",
    "rung": 6,
    "notionalUsd": 42527.8062555,
    "n": 106
   },
   {
    "pair": "USDT/USDC",
    "rung": 0,
    "notionalUsd": 5.316004,
    "n": 105
   },
   {
    "pair": "USDT/USDC",
    "rung": 1,
    "notionalUsd": 26.580019,
    "n": 105
   },
   {
    "pair": "USDT/USDC",
    "rung": 2,
    "notionalUsd": 106.320077,
    "n": 105
   },
   {
    "pair": "USDT/USDC",
    "rung": 3,
    "notionalUsd": 531.600384,
    "n": 105
   },
   {
    "pair": "USDT/USDC",
    "rung": 4,
    "notionalUsd": 2126.401538,
    "n": 105
   },
   {
    "pair": "USDT/USDC",
    "rung": 5,
    "notionalUsd": 10632.007688,
    "n": 104
   },
   {
    "pair": "USDT/USDC",
    "rung": 6,
    "notionalUsd": 42528.030752,
    "n": 104
   },
   {
    "pair": "WIF/USDC",
    "rung": 0,
    "notionalUsd": 5,
    "n": 69
   },
   {
    "pair": "WIF/USDC",
    "rung": 1,
    "notionalUsd": 25,
    "n": 69
   },
   {
    "pair": "WIF/USDC",
    "rung": 2,
    "notionalUsd": 100,
    "n": 69
   },
   {
    "pair": "WIF/USDC",
    "rung": 3,
    "notionalUsd": 500,
    "n": 69
   },
   {